,AwardID,Abstract,Abstract_Tokens,Abstract2,Label
6,0201303,"DDMS-  and   This award provides partial support for active research mathematicians and scientists with limited means of support to atd in  on   and their  to be held at  from   through , in , . The award, together with other funding, will provide travel support for some of the speakers and for some participants who do not have funds available through other source, with priority given to graduate students, recent 's, minorities and women. As part of the conference,  on   and  aimed at graduate students and recent 's will be presented on .   will be sponsored by , , , its  (), , , and . The organizers of the conference look for interaction among mathematicians, scientists and engineers. The conference will include the following speakers,  sessions,   lectures, and other activities:  Speakers:  , , , , , , , , , , , , , , , , , , , , ,   :  -  analysis ( operators, Wavelets, non-linear transformations, Harmonic analysis/Fourier analysis,  integral operators, Discrete potial theory, Initial value and boundary value problems)  - Geometry (Geometric index theory,  and noncommutative geometry, Geometric integral transforms,  structures and  operators, Twistors, tractors, and related topics, Invariant differential operators,  geometry)  - Mathematical structures (  and  groups,  theory, structural methods,  forms,  forms,  groups,   over arbitrary fields, , spinor representations, exceptional , super ,   and their generalizations, Infinite dimensional   and  bundles)  - Physics (Perturbative renormalization and  algebra antipodes, Spectral triples and elementary particle physics, q-deformations and noncommutative spacetime,  using   and other algebraic techniques,  foams and  gravity,   mechanics and  fields,  equation in electron physics, , on-associative structures, octonions, division  and their applications in physics)  -  in computer science, robotics, engineering ( computers, error correction, algorithms, Robotics, inverse kinematics, space , navigation, cybernetics, image processing and engineering, eural s)   on   and  ():  Lecture : Introduction to   () Lecture : Mathematical structure of   () Lecture :  analysis () Lecture :   in mathematical physics () Lecture :   in engineering () Lecture :   in differential geometry ()  Additionally, poster session, round table discussion, and book exhibits are also planned. The organizers expect to recruit  additional speakers. Further  information is available at http://math.tntech.edu/rafal/cookeville/cookeville.html.","['award', 'provides', 'partial', 'support', 'active', 'research', 'mathematician', 'scientist', 'limited', 'mean', 'support', 'atd', 'held', 'award', 'together', 'funding', 'provide', 'travel', 'support', 'speaker', 'participant', 'fund', 'available', 'source', 'priority', 'given', 'graduate', 'student', 'recent', 'minority', 'woman', 'part', 'conference', 'aimed', 'graduate', 'student', 'recent', 'presented', 'sponsored', 'organizer', 'conference', 'look', 'interaction', 'among', 'mathematician', 'scientist', 'engineer', 'conference', 'include', 'following', 'speaker', 'session', 'lecture', 'activity', 'speaker', 'analysis', 'operator', 'wavelet', 'transformation', 'harmonic', 'analysis', 'integral', 'operator', 'discrete', 'potial', 'theory', 'initial', 'value', 'boundary', 'value', 'problem', 'geometry', 'geometric', 'index', 'theory', 'noncommutative', 'geometry', 'geometric', 'integral', 'transforms', 'structure', 'operator', 'twistors', 'tractor', 'related', 'topic', 'invariant', 'differential', 'operator', 'geometry', 'mathematical', 'structure', 'group', 'theory', 'structural', 'method', 'form', 'form', 'group', 'arbitrary', 'field', 'spinor', 'representation', 'exceptional', 'super', 'generalization', 'infinite', 'dimensional', 'bundle', 'physic', 'perturbative', 'renormalization', 'algebra', 'antipode', 'spectral', 'triple', 'elementary', 'particle', 'physic', 'noncommutative', 'spacetime', 'using', 'algebraic', 'technique', 'foam', 'gravity', 'mechanic', 'field', 'equation', 'electron', 'physic', 'structure', 'octonions', 'division', 'application', 'physic', 'computer', 'science', 'robotics', 'engineering', 'computer', 'error', 'correction', 'algorithm', 'robotics', 'inverse', 'kinematics', 'space', 'navigation', 'cybernetics', 'image', 'processing', 'engineering', 'eural', 'lecture', 'introduction', 'lecture', 'mathematical', 'structure', 'lecture', 'analysis', 'lecture', 'mathematical', 'physic', 'lecture', 'engineering', 'lecture', 'differential', 'geometry', 'additionally', 'poster', 'session', 'round', 'table', 'discussion', 'book', 'exhibit', 'planned', 'organizer', 'expect', 'recruit', 'additional', 'speaker', 'information', 'available', 'http']",award provides partial support active research mathematician scientist limited mean support atd held award together funding provide travel support speaker participant fund available source priority given graduate student recent minority woman part conference aimed graduate student recent presented sponsored organizer conference look interaction among mathematician scientist engineer conference include following speaker session lecture activity speaker analysis operator wavelet transformation harmonic analysis integral operator discrete potial theory initial value boundary value problem geometry geometric index theory noncommutative geometry geometric integral transforms structure operator twistors tractor related topic invariant differential operator geometry mathematical structure group theory structural method form form group arbitrary field spinor representation exceptional super generalization infinite dimensional bundle physic perturbative renormalization algebra antipode spectral triple elementary particle physic noncommutative spacetime using algebraic technique foam gravity mechanic field equation electron physic structure octonions division application physic computer science robotics engineering computer error correction algorithm robotics inverse kinematics space navigation cybernetics image processing engineering eural lecture introduction lecture mathematical structure lecture analysis lecture mathematical physic lecture engineering lecture differential geometry additionally poster session round table discussion book exhibit planned organizer expect recruit additional speaker information available http,1
7,0201873,"In response to the national need for information technology workers with expertise in information systems security, this project is developing an associate degree program in computer security and data assurance at orwalk . The new program leads students either to immediate employment or to a related  degree at .  In developing the curriculum, investigators are examining existing computer security curricula and standards in order to adapt and build on exemplary resources. The investigators are also introducing a faculty externship program, which provides faculty members with relevant workplace experiences so they can better prepare their students for careers in the computer security field. Although the project is primary audience is  college faculty and students, the goal is to create a computer security career pathway from  schools to  colleges and on to universities. Objectives and activities in the project include:  * adapting computer security curricula to create a career pathway from  schools to  colleges and  universities;  * implementing an externship program for faculty;  * creating practical lab experiences with a Unix/T ""anti-hackers"" lab and teleconferencing equipment for distance learning;  * utilizing a faculty externship and student outreach coordinator to administer externship placements and recruit students for the computer security program;  * disseminating the computer security materials, curriculum, and model throughout ; and  * hosting an  cybersecurity conference.  The project is guided by an advisory committee of representatives from business and industry, professional associations in the computer security field, other colleges and universities, and law enforcement.","['response', 'national', 'need', 'information', 'technology', 'worker', 'expertise', 'information', 'system', 'security', 'project', 'developing', 'associate', 'degree', 'program', 'computer', 'security', 'data', 'assurance', 'orwalk', 'new', 'program', 'lead', 'student', 'either', 'immediate', 'employment', 'related', 'degree', 'developing', 'curriculum', 'investigator', 'examining', 'existing', 'computer', 'security', 'curriculum', 'standard', 'order', 'adapt', 'build', 'exemplary', 'resource', 'investigator', 'introducing', 'faculty', 'externship', 'program', 'provides', 'faculty', 'member', 'relevant', 'workplace', 'experience', 'prepare', 'student', 'career', 'computer', 'security', 'field', 'although', 'project', 'primary', 'audience', 'college', 'faculty', 'student', 'goal', 'create', 'computer', 'security', 'career', 'pathway', 'school', 'college', 'university', 'objective', 'activity', 'project', 'include', 'adapting', 'computer', 'security', 'curriculum', 'create', 'career', 'pathway', 'school', 'college', 'university', 'implementing', 'externship', 'program', 'faculty', 'creating', 'practical', 'lab', 'experience', 'lab', 'teleconferencing', 'equipment', 'distance', 'learning', 'utilizing', 'faculty', 'externship', 'student', 'outreach', 'coordinator', 'administer', 'externship', 'placement', 'recruit', 'student', 'computer', 'security', 'program', 'disseminating', 'computer', 'security', 'material', 'curriculum', 'model', 'throughout', 'hosting', 'cybersecurity', 'conference', 'project', 'guided', 'advisory', 'committee', 'representative', 'business', 'industry', 'professional', 'association', 'computer', 'security', 'field', 'college', 'university', 'law', 'enforcement']",response national need information technology worker expertise information system security project developing associate degree program computer security data assurance orwalk new program lead student either immediate employment related degree developing curriculum investigator examining existing computer security curriculum standard order adapt build exemplary resource investigator introducing faculty externship program provides faculty member relevant workplace experience prepare student career computer security field although project primary audience college faculty student goal create computer security career pathway school college university objective activity project include adapting computer security curriculum create career pathway school college university implementing externship program faculty creating practical lab experience lab teleconferencing equipment distance learning utilizing faculty externship student outreach coordinator administer externship placement recruit student computer security program disseminating computer security material curriculum model throughout hosting cybersecurity conference project guided advisory committee representative business industry professional association computer security field college university law enforcement,2
8,0202067,"EIA - , , ; , ; , ; , : : Research Infrastructure for   erks  This project, developing an open sensor  research infrastructure (), aims to catalyze fundamental advances in image and video computing,  protocols, and resource management to deal with unique spatio-temporal constraints of sensor s.  is composed of a sensor  of video cameras spanning several rooms, ed processing units, and a terabyte database, managed together to satisfy queries using those generated by mobile users within this environment. The infrastructure enables the following research projects: , interpretation, and prediction of human motion in video streams at multiple  scales in space/time and at multiple layers of detail;  b.   Development of efficient location management, routing, transport, and   distribution protocols for multi-resolution/scale streaming sensory data s;  c. Characterization of traffic and access patterns in mobile sensory s;  d. Instrumentation of embedded real-time operating systems to enable coordinated resource management and the development of middleware services for the management of active sensor s;  e. Indexing and mining of large spatio-temporal non-textual sensory datasets, with a particular emphasis on mining of human motions and activities;  f. Enhancing code safety for embedded systems through the use of type systems and run-time support, with emphasis on flow-oriented programming;  g. Development of algorithms and protocols for supporting security and trust, and for protecting the confidentiality and integrity of data in video sensor s and repositories.  These collaborative projects target  vertical applications. The  aims to merge the physical and cyber worlds in an integrated, well defined, privacy-protecting manner. It involves the development of a system capable of gathering, interpreting, routing, and storing data from distributed video sensors, and answering queries about the physical world on the Web. The  aims to develop assistive environments for people with severe disabilities, to help them gain access to computers, and thereby obtain a tool to communicate with their environments.  These applications will unify the various research projects leveraged by the  by acting as catalysts for the development of generic technologies that could be used (and reused) in other vertical applications.  ","['eia', 'research', 'infrastructure', 'erks', 'project', 'developing', 'open', 'sensor', 'research', 'infrastructure', 'aim', 'catalyze', 'fundamental', 'advance', 'image', 'video', 'computing', 'protocol', 'resource', 'management', 'deal', 'unique', 'constraint', 'sensor', 'composed', 'sensor', 'video', 'camera', 'spanning', 'several', 'room', 'ed', 'processing', 'unit', 'terabyte', 'database', 'managed', 'together', 'satisfy', 'query', 'using', 'generated', 'mobile', 'user', 'within', 'environment', 'infrastructure', 'enables', 'following', 'research', 'project', 'interpretation', 'prediction', 'human', 'motion', 'video', 'stream', 'multiple', 'scale', 'multiple', 'layer', 'detail', 'development', 'efficient', 'location', 'management', 'routing', 'transport', 'distribution', 'protocol', 'streaming', 'sensory', 'data', 'characterization', 'traffic', 'access', 'pattern', 'mobile', 'sensory', 'instrumentation', 'embedded', 'operating', 'system', 'enable', 'coordinated', 'resource', 'management', 'development', 'middleware', 'service', 'management', 'active', 'sensor', 'indexing', 'mining', 'large', 'sensory', 'datasets', 'particular', 'emphasis', 'mining', 'human', 'motion', 'activity', 'enhancing', 'code', 'safety', 'embedded', 'system', 'use', 'type', 'system', 'support', 'emphasis', 'programming', 'development', 'algorithm', 'protocol', 'supporting', 'security', 'trust', 'protecting', 'confidentiality', 'integrity', 'data', 'video', 'sensor', 'repository', 'collaborative', 'project', 'target', 'vertical', 'application', 'aim', 'merge', 'physical', 'cyber', 'world', 'integrated', 'defined', 'manner', 'involves', 'development', 'system', 'capable', 'gathering', 'interpreting', 'routing', 'storing', 'data', 'distributed', 'video', 'sensor', 'answering', 'query', 'physical', 'world', 'web', 'aim', 'develop', 'assistive', 'environment', 'people', 'severe', 'disability', 'help', 'gain', 'access', 'computer', 'thereby', 'obtain', 'tool', 'communicate', 'environment', 'application', 'unify', 'various', 'research', 'project', 'leveraged', 'acting', 'catalyst', 'development', 'generic', 'technology', 'could', 'used', 'reused', 'vertical', 'application']",eia research infrastructure erks project developing open sensor research infrastructure aim catalyze fundamental advance image video computing protocol resource management deal unique constraint sensor composed sensor video camera spanning several room ed processing unit terabyte database managed together satisfy query using generated mobile user within environment infrastructure enables following research project interpretation prediction human motion video stream multiple scale multiple layer detail development efficient location management routing transport distribution protocol streaming sensory data characterization traffic access pattern mobile sensory instrumentation embedded operating system enable coordinated resource management development middleware service management active sensor indexing mining large sensory datasets particular emphasis mining human motion activity enhancing code safety embedded system use type system support emphasis programming development algorithm protocol supporting security trust protecting confidentiality integrity data video sensor repository collaborative project target vertical application aim merge physical cyber world integrated defined manner involves development system capable gathering interpreting routing storing data distributed video sensor answering query physical world web aim develop assistive environment people severe disability help gain access computer thereby obtain tool communicate environment application unify various research project leveraged acting catalyst development generic technology could used reused vertical application,1
9,0202284,"Abstract  :  DMS-  Title: Saddlepoint and  and    systems underlie the models applied in most areas of modern science. These concepts have evolved over a long period of time but were heavily influenced more recently by the cybernetics movement spanning  until the late s. Those involved on the electrical engineering side of this movement used flow graphs to represent the systems. Interesting time-dependent system characteristics were naturally characterized in terms of the  transforms that could be associated with the flow graph. Their efforts lead to a general theory of finite state  systems that generalized the very restrictive  systems that are commonly applied even . Unfortunately, the inversion of the transforms in this approach proved to be a challenge that ultimately limited the impact of the flow graphs. This proposal addresses these inversions along with other missing tools so that a general systems theory may be fully developed into a complete mathematical discipline. These inversion tools, using saddlepoint methods, allow for the determination of the transient behavior of complex systems. In addition, the bootstrap is introduced for nonparametric statistical inference about the true system based on system observation. The range of applications in the engineering and biomedical sciences include communication and computer s, queueing theory, multi-state survival models, and right/left and interval censoring in the ext of the competing risks associated with such models. More specifically, this proposal addresses the following issues: () ew techniques are required for inverting the  transforms that characterize the complex behavior of systems; the author proposes several new saddlepoint methods for achieving this by using the method of steepest descents. () Transforms describing system characteristics need to be specified in ways that make the saddlepoint methods easy to use.  is rule is used but, because of its form, it is much too complicated to apply to large systems. The author has proposed several alternative co-factor rules that greatly simplify computations for the saddlepoint inversions. () onparametric statistical inference is to be developed for such  systems using the bootstrap and its relationship to empirical transforms. The single and double bootstrap lead to a practical means for computing confidence bands of survival and hazard functions related to the  process. The proposed double bootstrap is implemented through saddlepoint inversions.  This proposal studies the statistical and probabilistic traits of dynamic stochastic systems with feedback. The models for such systems are commonly used to make extrapolations and predictions in most areas of modern science. In engineering, for example, a communication or computer system changes from state to state and the dynamics of these state transitions determine the evolution of the system. This proposal considers the computation and estimation of reliability or performance evaluation for such an evolving dynamic system. The proposed methods have important applications in reliability analysis, electrical engineering, biomedical sciences and manufacturing.    ","['title', 'saddlepoint', 'system', 'underlie', 'model', 'applied', 'area', 'modern', 'science', 'concept', 'evolved', 'long', 'period', 'time', 'heavily', 'influenced', 'recently', 'cybernetics', 'movement', 'spanning', 'late', 'involved', 'electrical', 'engineering', 'side', 'movement', 'used', 'flow', 'graph', 'represent', 'system', 'interesting', 'system', 'characteristic', 'naturally', 'characterized', 'term', 'transforms', 'could', 'associated', 'flow', 'graph', 'effort', 'lead', 'general', 'theory', 'finite', 'state', 'system', 'generalized', 'restrictive', 'system', 'commonly', 'applied', 'even', 'unfortunately', 'inversion', 'transforms', 'approach', 'proved', 'challenge', 'ultimately', 'limited', 'impact', 'flow', 'graph', 'proposal', 'address', 'inversion', 'along', 'missing', 'tool', 'general', 'system', 'theory', 'may', 'fully', 'developed', 'complete', 'mathematical', 'discipline', 'inversion', 'tool', 'using', 'saddlepoint', 'method', 'allow', 'determination', 'transient', 'behavior', 'complex', 'system', 'addition', 'bootstrap', 'introduced', 'nonparametric', 'statistical', 'inference', 'true', 'system', 'based', 'system', 'observation', 'range', 'application', 'engineering', 'biomedical', 'science', 'include', 'communication', 'computer', 'queueing', 'theory', 'survival', 'model', 'interval', 'censoring', 'ext', 'competing', 'risk', 'associated', 'model', 'specifically', 'proposal', 'address', 'following', 'issue', 'ew', 'technique', 'required', 'inverting', 'transforms', 'characterize', 'complex', 'behavior', 'system', 'author', 'proposes', 'several', 'new', 'saddlepoint', 'method', 'achieving', 'using', 'method', 'steepest', 'descent', 'transforms', 'describing', 'system', 'characteristic', 'need', 'specified', 'way', 'make', 'saddlepoint', 'method', 'easy', 'use', 'rule', 'used', 'form', 'complicated', 'apply', 'large', 'system', 'author', 'proposed', 'several', 'alternative', 'rule', 'greatly', 'simplify', 'computation', 'saddlepoint', 'inversion', 'onparametric', 'statistical', 'inference', 'developed', 'system', 'using', 'bootstrap', 'relationship', 'empirical', 'transforms', 'single', 'double', 'bootstrap', 'lead', 'practical', 'mean', 'computing', 'confidence', 'band', 'survival', 'hazard', 'function', 'related', 'process', 'proposed', 'double', 'bootstrap', 'implemented', 'saddlepoint', 'inversion', 'proposal', 'study', 'statistical', 'probabilistic', 'trait', 'dynamic', 'stochastic', 'system', 'feedback', 'model', 'system', 'commonly', 'used', 'make', 'extrapolation', 'prediction', 'area', 'modern', 'science', 'engineering', 'example', 'communication', 'computer', 'system', 'change', 'state', 'state', 'dynamic', 'state', 'transition', 'determine', 'evolution', 'system', 'proposal', 'considers', 'computation', 'estimation', 'reliability', 'performance', 'evaluation', 'evolving', 'dynamic', 'system', 'proposed', 'method', 'important', 'application', 'reliability', 'analysis', 'electrical', 'engineering', 'biomedical', 'science', 'manufacturing']",title saddlepoint system underlie model applied area modern science concept evolved long period time heavily influenced recently cybernetics movement spanning late involved electrical engineering side movement used flow graph represent system interesting system characteristic naturally characterized term transforms could associated flow graph effort lead general theory finite state system generalized restrictive system commonly applied even unfortunately inversion transforms approach proved challenge ultimately limited impact flow graph proposal address inversion along missing tool general system theory may fully developed complete mathematical discipline inversion tool using saddlepoint method allow determination transient behavior complex system addition bootstrap introduced nonparametric statistical inference true system based system observation range application engineering biomedical science include communication computer queueing theory survival model interval censoring ext competing risk associated model specifically proposal address following issue ew technique required inverting transforms characterize complex behavior system author proposes several new saddlepoint method achieving using method steepest descent transforms describing system characteristic need specified way make saddlepoint method easy use rule used form complicated apply large system author proposed several alternative rule greatly simplify computation saddlepoint inversion onparametric statistical inference developed system using bootstrap relationship empirical transforms single double bootstrap lead practical mean computing confidence band survival hazard function related process proposed double bootstrap implemented saddlepoint inversion proposal study statistical probabilistic trait dynamic stochastic system feedback model system commonly used make extrapolation prediction area modern science engineering example communication computer system change state state dynamic state transition determine evolution system proposal considers computation estimation reliability performance evaluation evolving dynamic system proposed method important application reliability analysis electrical engineering biomedical science manufacturing,1
