,AwardID,Abstract,Abstract_Tokens,Abstract2,Label
10,0204267,"EIA- Good, , , ,   Title:   The Research Compnt of a Model IT College   This ITWF award provides support to ,  to use the tools of IT to serve the educational enterprise in the same way that these tools support business enterprises. In  the state of  recognized the shortage of IT workers and created , called the -college of , at  at .  The -college will design a database that will house data on every facet of the college is recruitment and  student experience across  computer-based  degree programs.  The database will:  provide a test-bed for conclusions derived from demographic and pedagogic research from other studies.  be mined for new associations and clusters of experience and behavior patterns that will suggest research in new directions.  provide data on the IT students of  and on the efficacy of the various strategies that the -college has implement to achieve its mission.  prototype recruitment and retion databases that could be installed in other IT college and thereby ribute an important tool to further the understanding of the efforts of IT colleges to serve underrepresented population groups.   built, this dynamic data model will be sustained within the -college and the data that it collects and the analysis that it engenders will provide insight to the longitudinal problem of maintaining the supply of college-trained professionals in the IT workforce nationally.   ","['good', 'title', 'research', 'compnt', 'model', 'college', 'itwf', 'award', 'provides', 'support', 'use', 'tool', 'serve', 'educational', 'enterprise', 'way', 'tool', 'support', 'business', 'enterprise', 'state', 'recognized', 'shortage', 'worker', 'created', 'called', 'design', 'database', 'house', 'data', 'every', 'facet', 'college', 'recruitment', 'student', 'experience', 'across', 'degree', 'program', 'database', 'provide', 'conclusion', 'derived', 'demographic', 'pedagogic', 'research', 'study', 'mined', 'new', 'association', 'cluster', 'experience', 'behavior', 'pattern', 'suggest', 'research', 'new', 'direction', 'provide', 'data', 'student', 'efficacy', 'various', 'strategy', 'implement', 'achieve', 'mission', 'prototype', 'recruitment', 'retion', 'database', 'could', 'installed', 'college', 'thereby', 'ribute', 'important', 'tool', 'understanding', 'effort', 'college', 'serve', 'underrepresented', 'population', 'group', 'built', 'dynamic', 'data', 'model', 'sustained', 'within', 'data', 'collect', 'analysis', 'engenders', 'provide', 'insight', 'longitudinal', 'problem', 'maintaining', 'supply', 'professional', 'workforce', 'nationally']",good title research compnt model college itwf award provides support use tool serve educational enterprise way tool support business enterprise state recognized shortage worker created called design database house data every facet college recruitment student experience across degree program database provide conclusion derived demographic pedagogic research study mined new association cluster experience behavior pattern suggest research new direction provide data student efficacy various strategy implement achieve mission prototype recruitment retion database could installed college thereby ribute important tool understanding effort college serve underrepresented population group built dynamic data model sustained within data collect analysis engenders provide insight longitudinal problem maintaining supply professional workforce nationally,2
11,0205526,"Large-scale coordination tasks are becoming increasingly important in hazardous, uncertain, and time-stressed environments such as rescue operations and disaster response. In such environments, human rescuers must rapidly make decisions while under stress and with incomplete and dynamic information, that may save or put lives at risk. The proposed multidisciplinary research is founded on  key advances/technical ideas. ) Teams of :  Agents, Robots and People (s) are hybrid teams that consist of large number of these entities, distributed in space and time and varying in capability and e. () A cooperative  paradigm facilitates the sharing of a) common goals, b) initiatives for communication and action, c) responsibilities for coherent group activity, d) information on the environment, mission, and situation, and e) assistance to overcoming barriers for various members of  groups whether human, robot or cyber-agent. () The key challenges for team formation and coordination in large-scale, uncertain coordination domains include ad hoc interoperability across different agents, teams and organizations that are brought together ""as is"", and co-adaptation to each other and to changing priorities and es within the team. The impact of having  technology successfully deployed will allow robots to advance beyond niche es in a handful of industries; instead they will be integrated into the larger society of humans and information systems in the workplace.  Emergency response teams are an early high-payoff test domain as robots can go places normally dangerous to humans, thus saving rescuers' and victims' lives.","['coordination', 'task', 'becoming', 'increasingly', 'important', 'hazardous', 'uncertain', 'environment', 'rescue', 'operation', 'disaster', 'response', 'environment', 'human', 'rescuer', 'must', 'rapidly', 'make', 'decision', 'stress', 'incomplete', 'dynamic', 'information', 'may', 'save', 'put', 'life', 'risk', 'proposed', 'multidisciplinary', 'research', 'founded', 'key', 'idea', 'team', 'agent', 'robot', 'people', 'hybrid', 'team', 'consist', 'large', 'number', 'entity', 'distributed', 'space', 'time', 'varying', 'capability', 'cooperative', 'paradigm', 'facilitates', 'sharing', 'common', 'goal', 'initiative', 'communication', 'action', 'responsibility', 'coherent', 'group', 'activity', 'information', 'environment', 'mission', 'situation', 'assistance', 'overcoming', 'barrier', 'various', 'member', 'group', 'whether', 'human', 'robot', 'key', 'challenge', 'team', 'formation', 'coordination', 'uncertain', 'coordination', 'domain', 'include', 'ad', 'hoc', 'interoperability', 'across', 'different', 'agent', 'team', 'organization', 'brought', 'together', 'changing', 'priority', 'within', 'team', 'impact', 'technology', 'successfully', 'deployed', 'allow', 'robot', 'advance', 'beyond', 'niche', 'handful', 'industry', 'instead', 'integrated', 'larger', 'society', 'human', 'information', 'system', 'workplace', 'emergency', 'response', 'team', 'early', 'test', 'domain', 'robot', 'go', 'place', 'normally', 'dangerous', 'human', 'thus', 'saving', 'rescuer', 'victim', 'life']",coordination task becoming increasingly important hazardous uncertain environment rescue operation disaster response environment human rescuer must rapidly make decision stress incomplete dynamic information may save put life risk proposed multidisciplinary research founded key idea team agent robot people hybrid team consist large number entity distributed space time varying capability cooperative paradigm facilitates sharing common goal initiative communication action responsibility coherent group activity information environment mission situation assistance overcoming barrier various member group whether human robot key challenge team formation coordination uncertain coordination domain include ad hoc interoperability across different agent team organization brought together changing priority within team impact technology successfully deployed allow robot advance beyond niche handful industry instead integrated larger society human information system workplace emergency response team early test domain robot go place normally dangerous human thus saving rescuer victim life,1
12,0206195," (, ) is producing  episodes of ""chase,"" with accompanying outreach, to exd the new animated television series into . "" chase,"" which began airing on  in , , engages children  in the fun and challenge of mathematics.  Its goal is to demonstrate the usefulness of mathematics and empower children to become mathematical problem-solvers by fostering a positive attitude toward mathematics, reinforcing basic mathematics concepts, modeling reasoning skills and motivating children to approach mathematics with confidence.  The funds will also support the design and implementation of an outreach program, including materials for parents; a workshop activity kit for schools, libraries and museums; and  pilot after-school programs.  Specifically, outreach compnts include:  A web compnt that provides mathematical activities and  for the target audience and their parents; A -page chase Magazine (, copies); A -page Teacher is  (, copies);  (, sets of  cards each); and a Poster   review, exsive evaluation and a national advisory board will inform all compnts.  ","['producing', 'episode', 'chase', 'accompanying', 'outreach', 'exd', 'new', 'animated', 'television', 'series', 'chase', 'began', 'airing', 'engages', 'child', 'fun', 'challenge', 'mathematics', 'goal', 'demonstrate', 'usefulness', 'mathematics', 'empower', 'child', 'become', 'mathematical', 'fostering', 'positive', 'attitude', 'toward', 'mathematics', 'reinforcing', 'basic', 'mathematics', 'concept', 'modeling', 'reasoning', 'skill', 'motivating', 'child', 'approach', 'mathematics', 'confidence', 'fund', 'support', 'design', 'implementation', 'outreach', 'program', 'including', 'material', 'parent', 'workshop', 'activity', 'kit', 'school', 'library', 'museum', 'pilot', 'program', 'specifically', 'outreach', 'compnts', 'include', 'web', 'compnt', 'provides', 'mathematical', 'activity', 'target', 'audience', 'parent', 'chase', 'magazine', 'copy', 'teacher', 'copy', 'set', 'card', 'poster', 'review', 'exsive', 'evaluation', 'national', 'advisory', 'board', 'inform', 'compnts']",producing episode chase accompanying outreach exd new animated television series chase began airing engages child fun challenge mathematics goal demonstrate usefulness mathematics empower child become mathematical fostering positive attitude toward mathematics reinforcing basic mathematics concept modeling reasoning skill motivating child approach mathematics confidence fund support design implementation outreach program including material parent workshop activity kit school library museum pilot program specifically outreach compnts include web compnt provides mathematical activity target audience parent chase magazine copy teacher copy set card poster review exsive evaluation national advisory board inform compnts,2
13,0208779," logic is a semantic foundation for implementing evidential transactions using the public key infrastructure ().  Evidential transactions form the basis of frameworks for authorization and authentication, electronic commerce, business workflow, and  government.  Such transactions involve the exchange of physical evidence in the form of identity cards, driver is licenses, my, checks, visas, airline tickets, traffic tickets, birth certificates, and stock certificates, as well as electronic evidence including  numbers, passwords, keys, certificates, and nonces.  logic is an enabling foundation for building and analyzing protocols that involve the exchange of electronic forms of evidence.  logic builds on evidence, public keys, and protocols.  , evidence is encoded by means of numbers using  certificates and nonces. , public keys are predicates so that any information $i$ signed by a private key corresponding to the public key $P$ entails that $P$ holds of $i$.  Indeed, the signed certificate is a proof for the assertion ained in the certificate.  , protocols are distributed logic programs that gather evidence by using both ordinary predicates and  certificates.   These simple building blocks can be used to construct a rich variety of services in a variety of domains ranging from  government to access  in computer systems.  The public key infrastructure () provides basic services for encryption, authentication, trust, authorization, and  certificates.  logic is a protocol layer over the  that serves as a reliable foundation for evidential transactions.  It provides a standardized semantic and computational infrastructure for exchanging evidence in electronic form.  With such a foundation, it is possible to design secure electronic versions of transactions that currently require physical forms of evidence. ","['logic', 'semantic', 'foundation', 'implementing', 'evidential', 'transaction', 'using', 'public', 'key', 'infrastructure', 'evidential', 'transaction', 'form', 'basis', 'framework', 'authorization', 'authentication', 'electronic', 'commerce', 'business', 'workflow', 'government', 'transaction', 'involve', 'exchange', 'physical', 'evidence', 'form', 'identity', 'card', 'driver', 'license', 'check', 'visa', 'airline', 'ticket', 'traffic', 'ticket', 'birth', 'certificate', 'stock', 'certificate', 'electronic', 'evidence', 'including', 'number', 'password', 'key', 'certificate', 'nonce', 'logic', 'enabling', 'foundation', 'building', 'analyzing', 'protocol', 'involve', 'exchange', 'electronic', 'form', 'evidence', 'logic', 'build', 'evidence', 'public', 'key', 'protocol', 'evidence', 'encoded', 'mean', 'number', 'using', 'certificate', 'nonce', 'public', 'key', 'predicate', 'information', 'signed', 'private', 'key', 'corresponding', 'public', 'key', 'entail', 'hold', 'indeed', 'signed', 'certificate', 'proof', 'assertion', 'ained', 'certificate', 'protocol', 'distributed', 'logic', 'program', 'gather', 'evidence', 'using', 'ordinary', 'predicate', 'certificate', 'simple', 'building', 'block', 'used', 'construct', 'rich', 'variety', 'service', 'variety', 'domain', 'ranging', 'government', 'access', 'computer', 'system', 'public', 'key', 'infrastructure', 'provides', 'basic', 'service', 'encryption', 'authentication', 'trust', 'authorization', 'certificate', 'logic', 'protocol', 'layer', 'serf', 'reliable', 'foundation', 'evidential', 'transaction', 'provides', 'standardized', 'semantic', 'computational', 'infrastructure', 'exchanging', 'evidence', 'electronic', 'form', 'foundation', 'possible', 'design', 'secure', 'electronic', 'version', 'transaction', 'currently', 'require', 'physical', 'form', 'evidence']",logic semantic foundation implementing evidential transaction using public key infrastructure evidential transaction form basis framework authorization authentication electronic commerce business workflow government transaction involve exchange physical evidence form identity card driver license check visa airline ticket traffic ticket birth certificate stock certificate electronic evidence including number password key certificate nonce logic enabling foundation building analyzing protocol involve exchange electronic form evidence logic build evidence public key protocol evidence encoded mean number using certificate nonce public key predicate information signed private key corresponding public key entail hold indeed signed certificate proof assertion ained certificate protocol distributed logic program gather evidence using ordinary predicate certificate simple building block used construct rich variety service variety domain ranging government access computer system public key infrastructure provides basic service encryption authentication trust authorization certificate logic protocol layer serf reliable foundation evidential transaction provides standardized semantic computational infrastructure exchanging evidence electronic form foundation possible design secure electronic version transaction currently require physical form evidence,1
14,0208848,"The objective of the proposed research is to improve  security through an innovative approach to vulnerability and resiliency analysis. Even well administered s are vulnerable to attacks due to the security ramifications of offering a variety of combined services. That is, services that are secure when offered in isolation ntheless provide an attacker with combined vulnerabilities to exploit when offered simultaneously.  Security tools such as COPS, System Scanner, and , are excellent at identifying specific, known, individual host vulnerabilities in services, software packages, and configurations. What these methods do not address is the compound effect of multiple vulnerabilities.  The result is a serious problem because interactions between vulnerabilities can easily cascade across a .  The risk posed by each vulnerability may be judged either necessary or acceptable in isolation, but the combination of these vulnerabilities can still turn out to compromise the  as a whole in an unacceptable way. A limited amount of existing work in vulnerability analysis addresses this problem, but the existing work falls short in  key areas, namely resiliency analysis, all-paths analysis, and inference engine analysis.  The proposed work will improve  security by addressing systematically each of these  areas.","['objective', 'proposed', 'research', 'improve', 'security', 'innovative', 'approach', 'vulnerability', 'resiliency', 'analysis', 'even', 'administered', 'vulnerable', 'attack', 'due', 'security', 'ramification', 'offering', 'variety', 'combined', 'service', 'service', 'secure', 'offered', 'isolation', 'ntheless', 'provide', 'attacker', 'combined', 'vulnerability', 'exploit', 'offered', 'simultaneously', 'security', 'tool', 'cop', 'system', 'scanner', 'excellent', 'identifying', 'specific', 'known', 'individual', 'host', 'vulnerability', 'service', 'software', 'package', 'configuration', 'method', 'address', 'compound', 'effect', 'multiple', 'vulnerability', 'result', 'serious', 'problem', 'interaction', 'vulnerability', 'easily', 'cascade', 'across', 'risk', 'posed', 'vulnerability', 'may', 'judged', 'either', 'necessary', 'acceptable', 'isolation', 'combination', 'vulnerability', 'still', 'turn', 'compromise', 'whole', 'unacceptable', 'way', 'limited', 'amount', 'existing', 'work', 'vulnerability', 'analysis', 'address', 'problem', 'existing', 'work', 'fall', 'short', 'key', 'area', 'namely', 'resiliency', 'analysis', 'analysis', 'inference', 'engine', 'analysis', 'proposed', 'work', 'improve', 'security', 'addressing', 'systematically', 'area']",objective proposed research improve security innovative approach vulnerability resiliency analysis even administered vulnerable attack due security ramification offering variety combined service service secure offered isolation ntheless provide attacker combined vulnerability exploit offered simultaneously security tool cop system scanner excellent identifying specific known individual host vulnerability service software package configuration method address compound effect multiple vulnerability result serious problem interaction vulnerability easily cascade across risk posed vulnerability may judged either necessary acceptable isolation combination vulnerability still turn compromise whole unacceptable way limited amount existing work vulnerability analysis address problem existing work fall short key area namely resiliency analysis analysis inference engine analysis proposed work improve security addressing systematically area,2
15,0209144,"This research will investigate the design of a peer-to-peer  built around secure coprocessors. The , named , will be designed to have a level of resiliency in the event of cyberattack on the Internet infrastructure.  The combination of secure coprocessing and peer-to-peer technologies will create a distributed survivable trusrthy backb which enables functionality for critical infrastructure that hitherto did not exist.    A  node must be highly trusrthy for many applications. The secure coprocessor is kernel must ensure that applications do not interfere with each other.  must remain connected during a  cyberattack on the routing infrastructure. Authentication infrastructure for diverse user, application, and trust requirements will be developed.  The solutions to these problems will draw on technologies for secure execution, , secure systems, and ing systems evaluation.  To prove these concepts, middle-ware will be developed that encodes the candidate solutions and will be installed on a small scale  system.  Much larger  systems, which could support critical infrastructure systems, will be simulated to evaluate their performance, and resiliency in the face of  attack.","['research', 'investigate', 'design', 'built', 'around', 'secure', 'coprocessors', 'named', 'designed', 'level', 'resiliency', 'event', 'cyberattack', 'internet', 'infrastructure', 'combination', 'secure', 'coprocessing', 'technology', 'create', 'distributed', 'survivable', 'trusrthy', 'backb', 'enables', 'functionality', 'critical', 'infrastructure', 'hitherto', 'exist', 'node', 'must', 'highly', 'trusrthy', 'application', 'secure', 'coprocessor', 'kernel', 'must', 'ensure', 'application', 'interfere', 'must', 'remain', 'connected', 'cyberattack', 'routing', 'infrastructure', 'authentication', 'infrastructure', 'diverse', 'user', 'application', 'trust', 'requirement', 'developed', 'solution', 'problem', 'draw', 'technology', 'secure', 'execution', 'secure', 'system', 'ing', 'system', 'evaluation', 'prove', 'concept', 'developed', 'encodes', 'candidate', 'solution', 'installed', 'small', 'scale', 'system', 'larger', 'system', 'could', 'support', 'critical', 'infrastructure', 'system', 'simulated', 'evaluate', 'performance', 'resiliency', 'face', 'attack']",research investigate design built around secure coprocessors named designed level resiliency event cyberattack internet infrastructure combination secure coprocessing technology create distributed survivable trusrthy backb enables functionality critical infrastructure hitherto exist node must highly trusrthy application secure coprocessor kernel must ensure application interfere must remain connected cyberattack routing infrastructure authentication infrastructure diverse user application trust requirement developed solution problem draw technology secure execution secure system ing system evaluation prove concept developed encodes candidate solution installed small scale system larger system could support critical infrastructure system simulated evaluate performance resiliency face attack,1
16,0210334," (UC),  (), and the State University of -Institute of Technology at  (YIT),  () and  () are improving institutional and regional capabilities in  education and training via: )   physically located at  adjacent to  and other technology organizations engaged in information assurance research and technologies. The  will focus on the development and placement of interns from undergraduate and graduate programs affiliated with the , for ; ) multidisciplinary undergraduate degree programs in  designed to draw upon the strengths of each institution; UC in cyber crime investigations and computer forensics, YIT in software and product development and telecommunications, and  is as  in  ; ) multidisciplinary graduate degree programs in  that parallel the undergraduate programs of study; and )  articulated agreements with  and  to support their developing programs of study in , including  degree programs.","['uc', 'state', 'university', 'technology', 'yit', 'improving', 'institutional', 'regional', 'capability', 'education', 'training', 'physically', 'located', 'adjacent', 'technology', 'organization', 'engaged', 'information', 'assurance', 'research', 'technology', 'focus', 'development', 'placement', 'intern', 'undergraduate', 'graduate', 'program', 'affiliated', 'multidisciplinary', 'undergraduate', 'degree', 'program', 'designed', 'draw', 'upon', 'strength', 'institution', 'uc', 'cyber', 'crime', 'investigation', 'computer', 'forensics', 'yit', 'software', 'product', 'development', 'telecommunication', 'multidisciplinary', 'graduate', 'degree', 'program', 'parallel', 'undergraduate', 'program', 'study', 'articulated', 'agreement', 'support', 'developing', 'program', 'study', 'including', 'degree', 'program']",uc state university technology yit improving institutional regional capability education training physically located adjacent technology organization engaged information assurance research technology focus development placement intern undergraduate graduate program affiliated multidisciplinary undergraduate degree program designed draw upon strength institution uc cyber crime investigation computer forensics yit software product development telecommunication multidisciplinary graduate degree program parallel undergraduate program study articulated agreement support developing program study including degree program,2
