,AwardID,Abstract,Abstract_Tokens,Abstract2,Label
22,0224501,"Cataclysms and Catastrophes-The Role of Science  This project is developing and field-testing curricular materials based on the e of science in causing and/or understanding catastrophes.  The goal of the materials is to help high school teachers incorporate geoscience into the teaching of physics, mathematics, chemistry and biology. This is a collaborative effort involving  (),  (), and empowerment, an -based private education company. Events that capture the imagination of teachers and students alike-for example, the devastation caused by  in , the  asteroid impact event, and the  bombing-serve as the basis for inquiry-based, hands-on learning activities using data collected by  and  scientists. Activities are expanded to include familiarity with technologies such as  (LIght Detection And Ranging), drilling, seismic reflection and refraction, geophysical logging, and the Internet. In addition to teaching concepts in science and mathematics,  theme carries implications for disaster prevention, awareness, and decision-making. Using seismology to identify nuclear explosions (monitoring nuclear testing worldwide), for example, is important to national security.  materials developed for the project are posted to  is Web site,  and , and promoted through e-letters and collaborations with state and national science and mathematics educational agencies and organizations. r materials are also available to  (  System ) and to the  institutional members of the ational .  The project builds on the recent success of the ongoing  ( ) Leadership training program for the  high school science course, Geology,  (), developed in  by  researchers.  is a certification program of professional development and leadership training for  teachers sponsored by  and . The curricular materials developed for ""Cataclysms and Catastrophes-The Role of Science"" will also complement the   offering designed around the theme ""From  to "". ","['cataclysm', 'role', 'science', 'project', 'developing', 'curricular', 'material', 'based', 'science', 'causing', 'understanding', 'catastrophe', 'goal', 'material', 'help', 'high', 'school', 'teacher', 'incorporate', 'geoscience', 'teaching', 'physic', 'mathematics', 'chemistry', 'biology', 'collaborative', 'effort', 'involving', 'empowerment', 'private', 'education', 'company', 'event', 'capture', 'imagination', 'teacher', 'student', 'example', 'devastation', 'caused', 'asteroid', 'impact', 'event', 'basis', 'learning', 'activity', 'using', 'data', 'collected', 'scientist', 'activity', 'expanded', 'include', 'familiarity', 'technology', 'light', 'detection', 'ranging', 'drilling', 'seismic', 'reflection', 'refraction', 'geophysical', 'logging', 'internet', 'addition', 'teaching', 'concept', 'science', 'mathematics', 'theme', 'carry', 'implication', 'disaster', 'prevention', 'awareness', 'using', 'seismology', 'identify', 'nuclear', 'explosion', 'monitoring', 'nuclear', 'testing', 'worldwide', 'example', 'important', 'national', 'security', 'material', 'developed', 'project', 'posted', 'web', 'site', 'promoted', 'collaboration', 'state', 'national', 'science', 'mathematics', 'educational', 'agency', 'organization', 'material', 'available', 'system', 'institutional', 'member', 'ational', 'project', 'build', 'recent', 'success', 'ongoing', 'leadership', 'training', 'program', 'high', 'school', 'science', 'course', 'geology', 'developed', 'researcher', 'certification', 'program', 'professional', 'development', 'leadership', 'training', 'teacher', 'sponsored', 'curricular', 'material', 'developed', 'cataclysm', 'role', 'science', 'complement', 'offering', 'designed', 'around', 'theme']",cataclysm role science project developing curricular material based science causing understanding catastrophe goal material help high school teacher incorporate geoscience teaching physic mathematics chemistry biology collaborative effort involving empowerment private education company event capture imagination teacher student example devastation caused asteroid impact event basis learning activity using data collected scientist activity expanded include familiarity technology light detection ranging drilling seismic reflection refraction geophysical logging internet addition teaching concept science mathematics theme carry implication disaster prevention awareness using seismology identify nuclear explosion monitoring nuclear testing worldwide example important national security material developed project posted web site promoted collaboration state national science mathematics educational agency organization material available system institutional member ational project build recent success ongoing leadership training program high school science course geology developed researcher certification program professional development leadership training teacher sponsored curricular material developed cataclysm role science complement offering designed around theme,2
23,0224889,"Information security has become a critical concern of both government and industry, and numerous groups have independently called for more and better research and education efforts in computer security. During the  computer security education workshop () atded by industry and government agencies, there was a clear call to action for universities to create programs in information security. In response to these demands, faculty members from several universities have been working to increase both education and research in the area of information assurance. This initiative proposes to build on the existing strengths of the faculty and universities involved by creating . The  will be  of the  facilities dedicated to creating a simulated Internet for the purpose of researching, designing, and testing cyber defense mechanisms. The  will also be used to test key compnts of the critical infrastructure.","['information', 'security', 'become', 'critical', 'concern', 'government', 'industry', 'numerous', 'group', 'independently', 'called', 'research', 'education', 'effort', 'computer', 'security', 'computer', 'security', 'education', 'workshop', 'atded', 'industry', 'government', 'agency', 'clear', 'call', 'action', 'university', 'create', 'program', 'information', 'security', 'response', 'demand', 'faculty', 'member', 'several', 'university', 'working', 'increase', 'education', 'research', 'area', 'information', 'assurance', 'initiative', 'proposes', 'build', 'existing', 'strength', 'faculty', 'university', 'involved', 'creating', 'facility', 'dedicated', 'creating', 'simulated', 'internet', 'purpose', 'researching', 'designing', 'testing', 'cyber', 'defense', 'mechanism', 'used', 'test', 'key', 'compnts', 'critical', 'infrastructure']",information security become critical concern government industry numerous group independently called research education effort computer security computer security education workshop atded industry government agency clear call action university create program information security response demand faculty member several university working increase education research area information assurance initiative proposes build existing strength faculty university involved creating facility dedicated creating simulated internet purpose researching designing testing cyber defense mechanism used test key compnts critical infrastructure,2
24,0225191,"Information security has become a critical concern of both government and industry, and numerous groups have independently called for more and better research and education efforts in computer security.  During the  computer security education workshop () atded by industry and government agencies, there was a clear call to action for universities to create programs in information security.  In response to these demands, faculty members from several universities have been working to increase both education and research in the area of information assurance.  This initiative proposes to build on the existing strengths of the faculty and universities involved by creating .  The  will be  of the  facilities dedicated to creating a simulated Internet for the purpose of researching, designing, and testing cyber defense mechanisms.  The  will also be used to test key compnts of the critical infrastructure.","['information', 'security', 'become', 'critical', 'concern', 'government', 'industry', 'numerous', 'group', 'independently', 'called', 'research', 'education', 'effort', 'computer', 'security', 'computer', 'security', 'education', 'workshop', 'atded', 'industry', 'government', 'agency', 'clear', 'call', 'action', 'university', 'create', 'program', 'information', 'security', 'response', 'demand', 'faculty', 'member', 'several', 'university', 'working', 'increase', 'education', 'research', 'area', 'information', 'assurance', 'initiative', 'proposes', 'build', 'existing', 'strength', 'faculty', 'university', 'involved', 'creating', 'facility', 'dedicated', 'creating', 'simulated', 'internet', 'purpose', 'researching', 'designing', 'testing', 'cyber', 'defense', 'mechanism', 'used', 'test', 'key', 'compnts', 'critical', 'infrastructure']",information security become critical concern government industry numerous group independently called research education effort computer security computer security education workshop atded industry government agency clear call action university create program information security response demand faculty member several university working increase education research area information assurance initiative proposes build existing strength faculty university involved creating facility dedicated creating simulated internet purpose researching designing testing cyber defense mechanism used test key compnts critical infrastructure,2
25,0225421,"   The science erk () project seeks to bring leading-edge information management research to bear on creating a cyberinfrastructure for the solid earth geosciences to interlink multidisciplinary geoscience data sets in D space.  The need to manage the growing amounts of diverse  science data has been recognized through a series of -sponsored community meetings on .  The  collaboration between IT researchers, who represent key technology areas relevant to , and  science researchers, who represent a broad cross section of  science sub-disciplines, will provide the foundation for a national  program.  There is a pressing need in the  sciences for a national information infrastructure that enables the community to share databases and tools to enable interdisciplinary analysis of ed data sets in studying a wide range of phenomena including the interplay between tectonics and the evolution of sedimentary basins;  the e of mountain building in the evolution of climate and life;  broader predictive understanding and modeling capabilities of geologic hazards, such as earthquakes and volcanoes;  the D reconstruction of  the  through time;  and, managing the natural resources of our planet. Each of these problems requires interdisciplinary research to discover relationships among  science disciplines, and depends on the community is ability to construct an integrated geoscience information system.  The goal of  is to develop the necessary IT foundations and create such a system.  Many past and on-going projects in the geosciences have produced valuable sub-disciplinary and disciplinary databases.  umerous national centers and organizations such as , , the ational  (CEAS), the  quake   (SCEC), as well as government agencies such as  (), are ributing research and data to the community.  Building on this base, the imperative now is to take a step beyond research resulting in disciplinary databases, towards a new paradigm for interdisciplinary information integration and tool sharing via the creation of the  cyberinfrastructure.  The research products and services arising from  will be available to the entire scientific community and will transform the way in which geoscience research is conducted, opening unprecedented avenues for research and collaboration and providing the foundation for creating geoscience collaboratories. *** ","['science', 'erk', 'project', 'seek', 'bring', 'information', 'management', 'research', 'bear', 'creating', 'cyberinfrastructure', 'solid', 'earth', 'geosciences', 'interlink', 'multidisciplinary', 'geoscience', 'data', 'set', 'space', 'need', 'manage', 'growing', 'amount', 'diverse', 'science', 'data', 'recognized', 'series', 'community', 'meeting', 'collaboration', 'researcher', 'represent', 'key', 'technology', 'area', 'relevant', 'science', 'researcher', 'represent', 'broad', 'cross', 'section', 'science', 'provide', 'foundation', 'national', 'program', 'pressing', 'need', 'science', 'national', 'information', 'infrastructure', 'enables', 'community', 'share', 'database', 'tool', 'enable', 'interdisciplinary', 'analysis', 'ed', 'data', 'set', 'studying', 'wide', 'range', 'phenomenon', 'including', 'interplay', 'tectonics', 'evolution', 'sedimentary', 'basin', 'mountain', 'building', 'evolution', 'climate', 'life', 'broader', 'predictive', 'understanding', 'modeling', 'capability', 'geologic', 'hazard', 'earthquake', 'volcano', 'reconstruction', 'time', 'managing', 'natural', 'resource', 'planet', 'problem', 'requires', 'interdisciplinary', 'research', 'discover', 'relationship', 'among', 'science', 'discipline', 'depends', 'community', 'ability', 'construct', 'integrated', 'geoscience', 'information', 'system', 'goal', 'develop', 'necessary', 'foundation', 'create', 'system', 'past', 'project', 'geosciences', 'produced', 'valuable', 'disciplinary', 'database', 'umerous', 'national', 'center', 'organization', 'ational', 'ceas', 'quake', 'scec', 'government', 'agency', 'ributing', 'research', 'data', 'community', 'building', 'base', 'imperative', 'take', 'step', 'beyond', 'research', 'resulting', 'disciplinary', 'database', 'towards', 'new', 'paradigm', 'interdisciplinary', 'information', 'integration', 'tool', 'sharing', 'creation', 'cyberinfrastructure', 'research', 'product', 'service', 'arising', 'available', 'entire', 'scientific', 'community', 'transform', 'way', 'geoscience', 'research', 'conducted', 'opening', 'unprecedented', 'avenue', 'research', 'collaboration', 'providing', 'foundation', 'creating', 'geoscience', 'collaboratories']",science erk project seek bring information management research bear creating cyberinfrastructure solid earth geosciences interlink multidisciplinary geoscience data set space need manage growing amount diverse science data recognized series community meeting collaboration researcher represent key technology area relevant science researcher represent broad cross section science provide foundation national program pressing need science national information infrastructure enables community share database tool enable interdisciplinary analysis ed data set studying wide range phenomenon including interplay tectonics evolution sedimentary basin mountain building evolution climate life broader predictive understanding modeling capability geologic hazard earthquake volcano reconstruction time managing natural resource planet problem requires interdisciplinary research discover relationship among science discipline depends community ability construct integrated geoscience information system goal develop necessary foundation create system past project geosciences produced valuable disciplinary database umerous national center organization ational ceas quake scec government agency ributing research data community building base imperative take step beyond research resulting disciplinary database towards new paradigm interdisciplinary information integration tool sharing creation cyberinfrastructure research product service arising available entire scientific community transform way geoscience research conducted opening unprecedented avenue research collaboration providing foundation creating geoscience collaboratories,0
26,0225473,"   The science erk () project seeks to bring leading-edge information management research to bear on creating a cyberinfrastructure for the solid earth geosciences to interlink multidisciplinary geoscience data sets in D space.  The need to manage the growing amounts of diverse  science data has been recognized through a series of -sponsored community meetings on .  The  collaboration between IT researchers, who represent key technology areas relevant to , and  science researchers, who represent a broad cross section of  science sub-disciplines, will provide the foundation for a national  program.  There is a pressing need in the  sciences for a national information infrastructure that enables the community to share databases and tools to enable interdisciplinary analysis of ed data sets in studying a wide range of phenomena including the interplay between tectonics and the evolution of sedimentary basins;  the e of mountain building in the evolution of climate and life;  broader predictive understanding and modeling capabilities of geologic hazards, such as earthquakes and volcanoes;  the D reconstruction of  the  through time;  and, managing the natural resources of our planet. Each of these problems requires interdisciplinary research to discover relationships among  science disciplines, and depends on the community is ability to construct an integrated geoscience information system.  The goal of  is to develop the necessary IT foundations and create such a system.  Many past and on-going projects in the geosciences have produced valuable sub-disciplinary and disciplinary databases.  umerous national centers and organizations such as , , the ational  (CEAS), the  quake   (SCEC), as well as government agencies such as  (), are ributing research and data to the community.  Building on this base, the imperative now is to take a step beyond research resulting in disciplinary databases, towards a new paradigm for interdisciplinary information integration and tool sharing via the creation of the  cyberinfrastructure.  The research products and services arising from  will be available to the entire scientific community and will transform the way in which geoscience research is conducted, opening unprecedented avenues for research and collaboration and providing the foundation for creating geoscience collaboratories. *** ","['science', 'erk', 'project', 'seek', 'bring', 'information', 'management', 'research', 'bear', 'creating', 'cyberinfrastructure', 'solid', 'earth', 'geosciences', 'interlink', 'multidisciplinary', 'geoscience', 'data', 'set', 'space', 'need', 'manage', 'growing', 'amount', 'diverse', 'science', 'data', 'recognized', 'series', 'community', 'meeting', 'collaboration', 'researcher', 'represent', 'key', 'technology', 'area', 'relevant', 'science', 'researcher', 'represent', 'broad', 'cross', 'section', 'science', 'provide', 'foundation', 'national', 'program', 'pressing', 'need', 'science', 'national', 'information', 'infrastructure', 'enables', 'community', 'share', 'database', 'tool', 'enable', 'interdisciplinary', 'analysis', 'ed', 'data', 'set', 'studying', 'wide', 'range', 'phenomenon', 'including', 'interplay', 'tectonics', 'evolution', 'sedimentary', 'basin', 'mountain', 'building', 'evolution', 'climate', 'life', 'broader', 'predictive', 'understanding', 'modeling', 'capability', 'geologic', 'hazard', 'earthquake', 'volcano', 'reconstruction', 'time', 'managing', 'natural', 'resource', 'planet', 'problem', 'requires', 'interdisciplinary', 'research', 'discover', 'relationship', 'among', 'science', 'discipline', 'depends', 'community', 'ability', 'construct', 'integrated', 'geoscience', 'information', 'system', 'goal', 'develop', 'necessary', 'foundation', 'create', 'system', 'past', 'project', 'geosciences', 'produced', 'valuable', 'disciplinary', 'database', 'umerous', 'national', 'center', 'organization', 'ational', 'ceas', 'quake', 'scec', 'government', 'agency', 'ributing', 'research', 'data', 'community', 'building', 'base', 'imperative', 'take', 'step', 'beyond', 'research', 'resulting', 'disciplinary', 'database', 'towards', 'new', 'paradigm', 'interdisciplinary', 'information', 'integration', 'tool', 'sharing', 'creation', 'cyberinfrastructure', 'research', 'product', 'service', 'arising', 'available', 'entire', 'scientific', 'community', 'transform', 'way', 'geoscience', 'research', 'conducted', 'opening', 'unprecedented', 'avenue', 'research', 'collaboration', 'providing', 'foundation', 'creating', 'geoscience', 'collaboratories']",science erk project seek bring information management research bear creating cyberinfrastructure solid earth geosciences interlink multidisciplinary geoscience data set space need manage growing amount diverse science data recognized series community meeting collaboration researcher represent key technology area relevant science researcher represent broad cross section science provide foundation national program pressing need science national information infrastructure enables community share database tool enable interdisciplinary analysis ed data set studying wide range phenomenon including interplay tectonics evolution sedimentary basin mountain building evolution climate life broader predictive understanding modeling capability geologic hazard earthquake volcano reconstruction time managing natural resource planet problem requires interdisciplinary research discover relationship among science discipline depends community ability construct integrated geoscience information system goal develop necessary foundation create system past project geosciences produced valuable disciplinary database umerous national center organization ational ceas quake scec government agency ributing research data community building base imperative take step beyond research resulting disciplinary database towards new paradigm interdisciplinary information integration tool sharing creation cyberinfrastructure research product service arising available entire scientific community transform way geoscience research conducted opening unprecedented avenue research collaboration providing foundation creating geoscience collaboratories,0
